{
  "attempts": [
    {
      "artifacts": [
        "skills/run-execution-packet/tests/contract.yaml"
      ],
      "context": {
        "manifest_path": null,
        "skill_available": false
      },
      "contract_sha256": "sha256:a88827f05558dac71483e99fba27d3db69486490bf4ac9926a5df87ddbf9341a",
      "expected_trigger": true,
      "grader_ids": [
        "contract-schema",
        "matched-prompt-digest",
        "trigger-route",
        "forbidden-behavior",
        "metric-provenance"
      ],
      "metrics": {
        "input_tokens": null,
        "measurement": "not_run",
        "output_tokens": null,
        "tool_calls": null,
        "wall_time_seconds": null
      },
      "mode": "baseline",
      "outcome": {
        "reason": "hard_zero_cost_boundary_not_confirmed",
        "status": "planned_deferred"
      },
      "prompt_sha256": "sha256:f5119cbee3f2e52f9746913734d83ee1d95770da48c815355513bd42ba69e463",
      "scenario_id": "prepared-packet-run",
      "sequence": 1,
      "skill": "run-execution-packet"
    },
    {
      "artifacts": [
        "skills/run-execution-packet/tests/contract.yaml"
      ],
      "context": {
        "manifest_path": "skills/run-execution-packet/SKILL.md",
        "skill_available": true
      },
      "contract_sha256": "sha256:a88827f05558dac71483e99fba27d3db69486490bf4ac9926a5df87ddbf9341a",
      "expected_trigger": true,
      "grader_ids": [
        "contract-schema",
        "matched-prompt-digest",
        "trigger-route",
        "forbidden-behavior",
        "metric-provenance"
      ],
      "metrics": {
        "input_tokens": null,
        "measurement": "not_run",
        "output_tokens": null,
        "tool_calls": null,
        "wall_time_seconds": null
      },
      "mode": "treatment",
      "outcome": {
        "reason": "hard_zero_cost_boundary_not_confirmed",
        "status": "planned_deferred"
      },
      "prompt_sha256": "sha256:f5119cbee3f2e52f9746913734d83ee1d95770da48c815355513bd42ba69e463",
      "scenario_id": "prepared-packet-run",
      "sequence": 2,
      "skill": "run-execution-packet"
    },
    {
      "artifacts": [
        "skills/run-execution-packet/tests/contract.yaml"
      ],
      "context": {
        "manifest_path": null,
        "skill_available": false
      },
      "contract_sha256": "sha256:a88827f05558dac71483e99fba27d3db69486490bf4ac9926a5df87ddbf9341a",
      "expected_trigger": false,
      "grader_ids": [
        "contract-schema",
        "matched-prompt-digest",
        "trigger-route",
        "forbidden-behavior",
        "metric-provenance"
      ],
      "metrics": {
        "input_tokens": null,
        "measurement": "not_run",
        "output_tokens": null,
        "tool_calls": null,
        "wall_time_seconds": null
      },
      "mode": "baseline",
      "outcome": {
        "reason": "hard_zero_cost_boundary_not_confirmed",
        "status": "planned_deferred"
      },
      "prompt_sha256": "sha256:c1fcc0e11b724e4aa60b086ecd8ccfcee436d76a562413937ee31158110b95bb",
      "scenario_id": "packet-planning-request",
      "sequence": 3,
      "skill": "run-execution-packet"
    },
    {
      "artifacts": [
        "skills/run-execution-packet/tests/contract.yaml"
      ],
      "context": {
        "manifest_path": "skills/run-execution-packet/SKILL.md",
        "skill_available": true
      },
      "contract_sha256": "sha256:a88827f05558dac71483e99fba27d3db69486490bf4ac9926a5df87ddbf9341a",
      "expected_trigger": false,
      "grader_ids": [
        "contract-schema",
        "matched-prompt-digest",
        "trigger-route",
        "forbidden-behavior",
        "metric-provenance"
      ],
      "metrics": {
        "input_tokens": null,
        "measurement": "not_run",
        "output_tokens": null,
        "tool_calls": null,
        "wall_time_seconds": null
      },
      "mode": "treatment",
      "outcome": {
        "reason": "hard_zero_cost_boundary_not_confirmed",
        "status": "planned_deferred"
      },
      "prompt_sha256": "sha256:c1fcc0e11b724e4aa60b086ecd8ccfcee436d76a562413937ee31158110b95bb",
      "scenario_id": "packet-planning-request",
      "sequence": 4,
      "skill": "run-execution-packet"
    },
    {
      "artifacts": [
        "skills/run-execution-packet/tests/contract.yaml"
      ],
      "context": {
        "manifest_path": null,
        "skill_available": false
      },
      "contract_sha256": "sha256:a88827f05558dac71483e99fba27d3db69486490bf4ac9926a5df87ddbf9341a",
      "expected_trigger": false,
      "grader_ids": [
        "contract-schema",
        "matched-prompt-digest",
        "trigger-route",
        "forbidden-behavior",
        "metric-provenance"
      ],
      "metrics": {
        "input_tokens": null,
        "measurement": "not_run",
        "output_tokens": null,
        "tool_calls": null,
        "wall_time_seconds": null
      },
      "mode": "baseline",
      "outcome": {
        "reason": "hard_zero_cost_boundary_not_confirmed",
        "status": "planned_deferred"
      },
      "prompt_sha256": "sha256:c3d43eb16918f51b75ba4162cd7a86db76e98ef8b745d57dea13221e53ffa21d",
      "scenario_id": "bounded-single-task",
      "sequence": 5,
      "skill": "run-execution-packet"
    },
    {
      "artifacts": [
        "skills/run-execution-packet/tests/contract.yaml"
      ],
      "context": {
        "manifest_path": "skills/run-execution-packet/SKILL.md",
        "skill_available": true
      },
      "contract_sha256": "sha256:a88827f05558dac71483e99fba27d3db69486490bf4ac9926a5df87ddbf9341a",
      "expected_trigger": false,
      "grader_ids": [
        "contract-schema",
        "matched-prompt-digest",
        "trigger-route",
        "forbidden-behavior",
        "metric-provenance"
      ],
      "metrics": {
        "input_tokens": null,
        "measurement": "not_run",
        "output_tokens": null,
        "tool_calls": null,
        "wall_time_seconds": null
      },
      "mode": "treatment",
      "outcome": {
        "reason": "hard_zero_cost_boundary_not_confirmed",
        "status": "planned_deferred"
      },
      "prompt_sha256": "sha256:c3d43eb16918f51b75ba4162cd7a86db76e98ef8b745d57dea13221e53ffa21d",
      "scenario_id": "bounded-single-task",
      "sequence": 6,
      "skill": "run-execution-packet"
    },
    {
      "artifacts": [
        "skills/knowledge-search/tests/contract.yaml"
      ],
      "context": {
        "manifest_path": null,
        "skill_available": false
      },
      "contract_sha256": "sha256:5d70edf54f755b1fc1c0406f9b866a883c26372a66bf083dc052a8a79abe87ce",
      "expected_trigger": true,
      "grader_ids": [
        "contract-schema",
        "matched-prompt-digest",
        "trigger-route",
        "forbidden-behavior",
        "metric-provenance"
      ],
      "metrics": {
        "input_tokens": null,
        "measurement": "not_run",
        "output_tokens": null,
        "tool_calls": null,
        "wall_time_seconds": null
      },
      "mode": "baseline",
      "outcome": {
        "reason": "hard_zero_cost_boundary_not_confirmed",
        "status": "planned_deferred"
      },
      "prompt_sha256": "sha256:f2570da4c9c564e1bdf0af64cb3b9ad675ec20f86b0969b154e9343fe890941a",
      "scenario_id": "preflight-prior-lessons",
      "sequence": 7,
      "skill": "knowledge-search"
    },
    {
      "artifacts": [
        "skills/knowledge-search/tests/contract.yaml"
      ],
      "context": {
        "manifest_path": "skills/knowledge-search/SKILL.md",
        "skill_available": true
      },
      "contract_sha256": "sha256:5d70edf54f755b1fc1c0406f9b866a883c26372a66bf083dc052a8a79abe87ce",
      "expected_trigger": true,
      "grader_ids": [
        "contract-schema",
        "matched-prompt-digest",
        "trigger-route",
        "forbidden-behavior",
        "metric-provenance"
      ],
      "metrics": {
        "input_tokens": null,
        "measurement": "not_run",
        "output_tokens": null,
        "tool_calls": null,
        "wall_time_seconds": null
      },
      "mode": "treatment",
      "outcome": {
        "reason": "hard_zero_cost_boundary_not_confirmed",
        "status": "planned_deferred"
      },
      "prompt_sha256": "sha256:f2570da4c9c564e1bdf0af64cb3b9ad675ec20f86b0969b154e9343fe890941a",
      "scenario_id": "preflight-prior-lessons",
      "sequence": 8,
      "skill": "knowledge-search"
    },
    {
      "artifacts": [
        "skills/knowledge-search/tests/contract.yaml"
      ],
      "context": {
        "manifest_path": null,
        "skill_available": false
      },
      "contract_sha256": "sha256:5d70edf54f755b1fc1c0406f9b866a883c26372a66bf083dc052a8a79abe87ce",
      "expected_trigger": true,
      "grader_ids": [
        "contract-schema",
        "matched-prompt-digest",
        "trigger-route",
        "forbidden-behavior",
        "metric-provenance"
      ],
      "metrics": {
        "input_tokens": null,
        "measurement": "not_run",
        "output_tokens": null,
        "tool_calls": null,
        "wall_time_seconds": null
      },
      "mode": "baseline",
      "outcome": {
        "reason": "hard_zero_cost_boundary_not_confirmed",
        "status": "planned_deferred"
      },
      "prompt_sha256": "sha256:18161fbf4d2d41bb5c7cb43c10dde654d44953157d87eb6dcc28d012511f9f63",
      "scenario_id": "incident-prevention-check",
      "sequence": 9,
      "skill": "knowledge-search"
    },
    {
      "artifacts": [
        "skills/knowledge-search/tests/contract.yaml"
      ],
      "context": {
        "manifest_path": "skills/knowledge-search/SKILL.md",
        "skill_available": true
      },
      "contract_sha256": "sha256:5d70edf54f755b1fc1c0406f9b866a883c26372a66bf083dc052a8a79abe87ce",
      "expected_trigger": true,
      "grader_ids": [
        "contract-schema",
        "matched-prompt-digest",
        "trigger-route",
        "forbidden-behavior",
        "metric-provenance"
      ],